{
  "architecture": "B",
  "n_values": [64, 128, 256, 512, 1024],
  "costs": [
    {
      "n": 64,
      "per_party_comm_bytes": "O(1)",
      "per_party_compute_ops": "O(N*log N)",
      "aggregator_compute_ops": "O(N)",
      "verifier_compute_ops": "O(1)",
      "calldata_bytes": 14000,
      "gas": 350000
    },
    {
      "n": 128,
      "per_party_comm_bytes": "O(1)",
      "per_party_compute_ops": "O(N*log N)",
      "aggregator_compute_ops": "O(N)",
      "verifier_compute_ops": "O(1)",
      "calldata_bytes": 14000,
      "gas": 350000
    },
    {
      "n": 256,
      "per_party_comm_bytes": "O(1)",
      "per_party_compute_ops": "O(N*log N)",
      "aggregator_compute_ops": "O(N)",
      "verifier_compute_ops": "O(1)",
      "calldata_bytes": 14000,
      "gas": 350000
    },
    {
      "n": 512,
      "per_party_comm_bytes": "O(1)",
      "per_party_compute_ops": "O(N*log N)",
      "aggregator_compute_ops": "O(N)",
      "verifier_compute_ops": "O(1)",
      "calldata_bytes": 14000,
      "gas": 350000
    },
    {
      "n": 1024,
      "per_party_comm_bytes": "O(1)",
      "per_party_compute_ops": "O(N*log N)",
      "aggregator_compute_ops": "O(N)",
      "verifier_compute_ops": "O(1)",
      "calldata_bytes": 14000,
      "gas": 350000
    }
  ],
  "asymptotic": {
    "per_party_comm": "O(1)",
    "per_party_compute": "O(N log N)",
    "aggregator_compute": "O(N)",
    "verifier_compute": "O(1)",
    "calldata": "O(1)",
    "gas": "O(1)"
  },
  "notes": "Cost for 8192 is approximately 4096 gates per party. Total fold time ~37s for 1024 parties. Proof size ~14KB. Gas ~200k-500k."
}