{
  "architecture": "A",
  "n_values": [64, 128, 256, 512, 1024],
  "costs": [
    {
      "n": 64,
      "per_party_comm_bytes": 131072,
      "per_party_compute_ops": 33554432,
      "aggregator_compute_ops": 33554432,
      "verifier_compute_ops": 1024,
      "calldata_bytes": 1024,
      "gas": 3650000
    },
    {
      "n": 128,
      "per_party_comm_bytes": 131072,
      "per_party_compute_ops": 67108864,
      "aggregator_compute_ops": 67108864,
      "verifier_compute_ops": 1024,
      "calldata_bytes": 1024,
      "gas": 3650000
    },
    {
      "n": 256,
      "per_party_comm_bytes": 131072,
      "per_party_compute_ops": 134217728,
      "aggregator_compute_ops": 134217728,
      "verifier_compute_ops": 1024,
      "calldata_bytes": 1024,
      "gas": 7300000
    },
    {
      "n": 512,
      "per_party_comm_bytes": 131072,
      "per_party_compute_ops": 268435456,
      "aggregator_compute_ops": 268435456,
      "verifier_compute_ops": 1024,
      "calldata_bytes": 1024,
      "gas": 14600000
    },
    {
      "n": 1024,
      "per_party_comm_bytes": 131072,
      "per_party_compute_ops": 536870912,
      "aggregator_compute_ops": 536870912,
      "verifier_compute_ops": 1024,
      "calldata_bytes": 1024,
      "gas": 29200000
    }
  ],
  "asymptotic": {
    "per_party_comm": "O(N)",
    "per_party_compute": "O(n * N * log N)",
    "aggregator_compute": "O(n * N)",
    "verifier_compute": "O(polylog n)",
    "calldata": "O(1)",
    "gas": "O(n)"
  },
  "notes": "Gas scales linearly due to pairing constraints on Ethereum for full EVM verifier, or constant if wrapped in a recursive SNARK. The constant calldata assumes SNARK aggregation. N=8192 fixed."
}